<?xml version="1.0" encoding="UTF-8"?>
<!--Sample XML file generated by XMLSpy v2015 rel. 4 (http://www.altova.com)-->
<Atmos xmlns="http://chercheurs.edf.com/logiciels/atmos" xmlns:xsi="http://www.w3.org/2001/XMLSchema-instance" xsi:schemaLocation="http://chercheurs.edf.com/logiciels/atmos modele_atmo.xsd">
	<Wind>
		<Wind_Speed>20</Wind_Speed>
		<Speed_Unit>mph</Speed_Unit>
		<Measurement>manual</Measurement>
		<B_enter_mesure>
			<Value>10</Value>
			<Unit>meters</Unit>
		</B_enter_mesure>
	</Wind>
	<Ground>
		<Ground_roughness>manual</Ground_roughness>
		<B_enter_ground>
			<Value>30</Value>
			<Unit>cm</Unit>
		</B_enter_ground>
	</Ground>
	<Cover>
		<Cover_type>clear</Cover_type>
	</Cover>
</Atmos>
